variant_name,On-road prize,Engine Type,Displacement,Max Torque,No. of Cylinders,Cooling System,Valve Per Cylinder,Starting,Fuel Supply,Clutch,Ignition,Gear Box,Bore,Stroke,Compression Ratio,City Mileage,Highway Mileage,Body Type,0-100 Kmph (sec),Peak Power,Transmission
Indian Roadmaster Maroon Metallic,5230495,Thunderstroke 116,1890 cc,171 Nm @ 3000 rpm,Air Cooled,"Self Start Only,Remote Start",Fuel Injection,"Wet, Multi-Plate, Assist",6 Speed,103.2 mm,113 mm,11.0:1,bs6-2.0,,,"Cruiser Bikes, Tourer Bikes",,Yes,Telescopic Fork / 119 mm,,
Indian Roadmaster Limited Black Azure Crystal,4936935,Thunderstroke 116,1890 cc,171 Nm @ 3000 rpm,Air Cooled,"Self Start Only,Remote Start",Fuel Injection,"Wet, Multi-Plate, Assist",6 Speed,103.2 mm,113 mm,11.0:1,bs6-2.0,,,"Cruiser Bikes, Tourer Bikes",,Yes,Telescopic Fork/ 119 mm,,
Indian Challenger Dark Horse Indy Red,4152033,PowerPlus,1768 cc,178 Nm @ 3800 rpm,Liquid Cooled,123.69 PS,"Self Start Only,Remote Start",Fuel Injection,"Wet, Multi-Plate Assist",6 Speed,108 mm,96.5 mm,11.0:1,bs6-2.0,,"Adventure Tourer Bikes, Cruiser Bikes",,990 mm,Inverted Telescopic Fork/ 130mm,,
Indian Challenger Limited Black Metallic,4203057,PowerPlus,1768 cc,178 Nm @ 3800 rpm,Liquid Cooled,123.6 PS,"Self Start Only,Remote Start",Fuel Injection,"Wet, Multi-Plate Assist",6 Speed,108 mm,96.5 mm,11.0:1,bs6-2.0,,"Adventure Tourer Bikes, Cruiser Bikes",,990 mm,Inverted Telescopic Fork/ 130mm,,
Indian Challenger Limited Spirit Blue Metallic,4217939,PowerPlus,1768 cc,178 Nm @ 3800 rpm,Liquid Cooled,123.6 PS,"Self Start Only,Remote Start",Fuel Injection,"Wet, Multi-Plate Assist",6 Speed,108 mm,96.5 mm,11.0:1,bs6-2.0,,"Adventure Tourer Bikes, Cruiser Bikes",,990 mm,Inverted Telescopic Fork/ 130mm,,
Indian Challenger Dark Horse lcon Riot Orange Smoke,4150172,PowerPlus,1768 cc,178 Nm @ 3800 rpm,Liquid Cooled,123.69 PS,"Self Start Only,Remote Start",Fuel Injection,"Wet, Multi-Plate Assist",6 Speed,108 mm,96.5 mm,11.0:1,bs6-2.0,,"Adventure Tourer Bikes, Cruiser Bikes",,990 mm,Inverted Telescopic Fork/ 130mm,,
Indian Roadmaster Black Metallic,4932133,Thunderstroke 116,1890 cc,171 Nm @ 3000 rpm,Air Cooled,"Self Start Only,Remote Start",Fuel Injection,"Wet, Multi-Plate, Assist",6 Speed,103.2 mm,113 mm,11.0:1,bs6-2.0,,,"Cruiser Bikes, Tourer Bikes",,Yes,Telescopic Fork / 119 mm,,
Indian Challenger Limited Maroon Metallic,4237870,PowerPlus,1768 cc,178 Nm @ 3800 rpm,Liquid Cooled,123.6 PS,"Self Start Only,Remote Start",Fuel Injection,"Wet, Multi-Plate Assist",6 Speed,108 mm,96.5 mm,11.0:1,bs6-2.0,,"Adventure Tourer Bikes, Cruiser Bikes",,990 mm,Inverted Telescopic Fork/ 130mm,,
Indian Challenger Dark Horse Bronze Smoke,4141136,PowerPlus,1768 cc,178 Nm @ 3800 rpm,Liquid Cooled,123.69 PS,"Self Start Only,Remote Start",Fuel Injection,"Wet, Multi-Plate Assist",6 Speed,108 mm,96.5 mm,11.0:1,bs6-2.0,,"Adventure Tourer Bikes, Cruiser Bikes",,990 mm,Inverted Telescopic Fork/ 130mm,,
Indian Challenger Dark Horse Black Smoke,4141136,PowerPlus,1768 cc,178 Nm @ 3800 rpm,Liquid Cooled,123.69 PS,"Self Start Only,Remote Start",Fuel Injection,"Wet, Multi-Plate Assist",6 Speed,108 mm,96.5 mm,11.0:1,bs6-2.0,,"Adventure Tourer Bikes, Cruiser Bikes",,990 mm,Inverted Telescopic Fork/ 130mm,,
Indian Pursuit Dark Horse Silver Quartz Smoke Premium Package,5115685,Liquid-cooled PowerPlus,1768 cc,178 Nm @ 3800 rpm,Liquid Cooled,"Self Start Only,Remote Start",Fuel Injection,"Wet, Multi-Plate, Assist",6 Speed,108 mm,96.5 mm,11.0:1,bs6-2.0,,,Yes,990 mm,LED,,,
Indian Pursuit Dark Horse Ruby Metallic Premium Package,5226483,Liquid-cooled PowerPlus,1768 cc,178 Nm @ 3800 rpm,Liquid Cooled,"Self Start Only,Remote Start",Fuel Injection,"Wet, Multi-Plate, Assist",6 Speed,108 mm,96.5 mm,11.0:1,bs6-2.0,,,Yes,990 mm,LED,,,
Indian Pursuit Limited Maroon Metallic,5125684,Liquid-cooled PowerPlus,1768 cc,178 Nm @ 3800 rpm,Liquid Cooled,"Self Start Only,Remote Start",Fuel Injection,"Wet, Multi-Plate, Assist",6 Speed,108 mm,96.5 mm,11.0:1,bs6-2.0,,,"Adventure Tourer Bikes, Tourer Bikes",,Yes,Inverted Telescopic Fork / 130 mm,,
Indian Pursuit Limited Alumina Jade Premium Package,5296744,Liquid-cooled PowerPlus,1768 cc,178 Nm @ 3800 rpm,Liquid Cooled,"Self Start Only,Remote Start",Fuel Injection,"Wet, Multi-Plate, Assist",6 Speed,108 mm,96.5 mm,11.0:1,bs6-2.0,,,"Adventure Tourer Bikes, Tourer Bikes",,Yes,Inverted Telescopic Fork / 130 mm,,
Indian Pursuit Dark Horse Icon Pearl White Premium Package,5226483,Liquid-cooled PowerPlus,1768 cc,178 Nm @ 3800 rpm,Liquid Cooled,"Self Start Only,Remote Start",Fuel Injection,"Wet, Multi-Plate, Assist",6 Speed,108 mm,96.5 mm,11.0:1,bs6-2.0,,,Yes,990 mm,LED,,,
Indian Pursuit Limited Maroon Metallic Premium Package,5276477,Liquid-cooled PowerPlus,1768 cc,178 Nm @ 3800 rpm,Liquid Cooled,"Self Start Only,Remote Start",Fuel Injection,"Wet, Multi-Plate, Assist",6 Speed,108 mm,96.5 mm,11.0:1,bs6-2.0,,,"Adventure Tourer Bikes, Tourer Bikes",,Yes,Inverted Telescopic Fork / 130 mm,,
Indian Pursuit Deepwater Metallic Premium Package,5080285,Liquid-cooled PowerPlus,1768 cc,178 Nm @ 3800 rpm,Liquid Cooled,"Self Start Only,Remote Start",Fuel Injection,"Wet, Multi-Plate, Assist",6 Speed,108 mm,96.5 mm,11.0:1,bs6-2.0,,,"Adventure Tourer Bikes, Tourer Bikes",,Yes,Inverted Telescopic Fork / 130 mm,,
Indian Pursuit Dark Horse Ruby Metallic,5062448,Liquid-cooled PowerPlus,1768 cc,178 Nm @ 3800 rpm,Liquid Cooled,"Self Start Only,Remote Start",Fuel Injection,"Wet, Multi-Plate, Assist",6 Speed,108 mm,96.5 mm,11.0:1,bs6-2.0,,,Yes,990 mm,LED,,,
Indian Pursuit Dark Horse Icon Quartz Gray Premium Package,5039479,Liquid-cooled PowerPlus,1768 cc,178 Nm @ 3800 rpm,Liquid Cooled,"Self Start Only,Remote Start",Fuel Injection,"Wet, Multi-Plate, Assist",6 Speed,108 mm,96.5 mm,11.0:1,bs6-2.0,,,Yes,990 mm,LED,,,
Indian Pursuit Dark Horse Black Smoke Premium Package,5029749,Liquid-cooled PowerPlus,1768 cc,178 Nm @ 3800 rpm,Liquid Cooled,"Self Start Only,Remote Start",Fuel Injection,"Wet, Multi-Plate, Assist",6 Speed,108 mm,96.5 mm,11.0:1,bs6-2.0,,,Yes,990 mm,LED,,,
Indian Pursuit Limited Black Metallic,4872472,Liquid-cooled PowerPlus,1768 cc,178 Nm @ 3800 rpm,Liquid Cooled,"Self Start Only,Remote Start",Fuel Injection,"Wet, Multi-Plate, Assist",6 Speed,108 mm,96.5 mm,11.0:1,bs6-2.0,,,"Adventure Tourer Bikes, Tourer Bikes",,Yes,Inverted Telescopic Fork / 130 mm,,
Indian Pursuit Dark Horse Silver Quartz Smoke,4965975,Liquid-cooled PowerPlus,1768 cc,178 Nm @ 3800 rpm,Liquid Cooled,"Self Start Only,Remote Start",Fuel Injection,"Wet, Multi-Plate, Assist",6 Speed,108 mm,96.5 mm,11.0:1,bs6-2.0,,,Yes,990 mm,LED,,,
Indian Pursuit Limited Deepwater Metallic,4916521,Liquid-cooled PowerPlus,1768 cc,178 Nm @ 3800 rpm,Liquid Cooled,"Self Start Only,Remote Start",Fuel Injection,"Wet, Multi-Plate, Assist",6 Speed,108 mm,96.5 mm,11.0:1,bs6-2.0,,,"Adventure Tourer Bikes, Tourer Bikes",,Yes,Inverted Telescopic Fork / 130 mm,,
Indian Pursuit Dark Horse Spirit Blue Metallic,4843017,Liquid-cooled PowerPlus,1768 cc,178 Nm @ 3800 rpm,Liquid Cooled,"Self Start Only,Remote Start",Fuel Injection,"Wet, Multi-Plate, Assist",6 Speed,108 mm,96.5 mm,11.0:1,bs6-2.0,,,Yes,990 mm,LED,,,
Indian Pursuit Dark Horse Spirit Blue Metal Premium Package,5039479,Liquid-cooled PowerPlus,1768 cc,178 Nm @ 3800 rpm,Liquid Cooled,"Self Start Only,Remote Start",Fuel Injection,"Wet, Multi-Plate, Assist",6 Speed,108 mm,96.5 mm,11.0:1,bs6-2.0,,,Yes,990 mm,LED,,,
Indian Pursuit Limited Black Metallic Premium Package,5036237,Liquid-cooled PowerPlus,1768 cc,178 Nm @ 3800 rpm,Liquid Cooled,"Self Start Only,Remote Start",Fuel Injection,"Wet, Multi-Plate, Assist",6 Speed,108 mm,96.5 mm,11.0:1,bs6-2.0,,,"Adventure Tourer Bikes, Tourer Bikes",,Yes,Inverted Telescopic Fork / 130 mm,,
Indian Pursuit Dark Horse Black Smoke,4833289,Liquid-cooled PowerPlus,1768 cc,178 Nm @ 3800 rpm,Liquid Cooled,"Self Start Only,Remote Start",Fuel Injection,"Wet, Multi-Plate, Assist",6 Speed,108 mm,96.5 mm,11.0:1,bs6-2.0,,,Yes,990 mm,LED,,,
Indian Roadmaster Limited Crimson Metallic,4898955,Thunderstroke 116,1890 cc,171 Nm @ 3000 rpm,Air Cooled,"Self Start Only,Remote Start",Fuel Injection,"Wet, Multi-Plate, Assist",6 Speed,103.2 mm,113 mm,11.0:1,bs6-2.0,,,"Cruiser Bikes, Tourer Bikes",,Yes,Telescopic Fork/ 119 mm,,
Indian Roadmaster Dark Horse Black Smoke,4865196,Thunderstroke 116,1890 cc,171 Nm @ 3000 rpm,Air Cooled,"Self Start Only,Remote Start",Fuel Injection,"Wet, Multi-Plate, Assist",6 Speed,103.2 mm,113 mm,11.0:1,bs6-2.0,,,"Cruiser Bikes, Tourer Bikes",,Yes,Telescopic Fork / 119 mm,,
Indian Pursuit Limited Alumina Jade Smoke,4704926,Liquid-cooled PowerPlus,1768 cc,178 Nm @ 3800 rpm,Liquid Cooled,"Self Start Only,Remote Start",Fuel Injection,"Wet, Multi-Plate, Assist",6 Speed,108 mm,96.5 mm,11.0:1,bs6-2.0,,,"Adventure Tourer Bikes, Tourer Bikes",,Yes,Inverted Telescopic Fork / 130 mm,,
Indian Roadmaster Dark Horse Polished Bronze,4883803,Thunderstroke 116,1890 cc,171 Nm @ 3000 rpm,Air Cooled,"Self Start Only,Remote Start",Fuel Injection,"Wet, Multi-Plate, Assist",6 Speed,103.2 mm,113 mm,11.0:1,bs6-2.0,,,"Cruiser Bikes, Tourer Bikes",,Yes,Telescopic Fork / 119 mm,,
Indian FTR R Carbon Fiber,2480226,Liquid Cooled V-Twin,1203 cc,120 Nm @ 6000 rpm,Liquid Cooled,Self Start Only,Fuel Injection,"Assist & Slip, Multi-Plate",6 Speed,102 mm,73.6 mm,12.5:1,bs6-2.0,,,Sports Naked Bikes,Yes,830 mm,Ohlins Fully Adjustable Inverted Telescopic Cartidge Fork / 120mm,,
Indian Roadmaster Dark Horse Silver Quartz Smoke,4883507,Thunderstroke 116,1890 cc,171 Nm @ 3000 rpm,Air Cooled,"Self Start Only,Remote Start",Fuel Injection,"Wet, Multi-Plate, Assist",6 Speed,103.2 mm,113 mm,11.0:1,bs6-2.0,,,"Cruiser Bikes, Tourer Bikes",,Yes,Telescopic Fork / 119 mm,,
Indian Chieftain Elite Heavy Metal Smoke,4220225,Thunderstroke 116,1890 cc,171 Nm @ 3000 rpm,Air Cooled,Self Start Only,Fuel Injection,"Wet, Multi-Plate, Assist",6 Speed,103.2 mm,113 mm,11.0:1,bs6-2.0,,,Tourer Bikes,,Yes,Telescopic Fork / 119 mm,,
Indian FTR S Maroon Metallic,2369733,Liquid Cooled V-Twin,1203 cc,120 Nm @ 6000 rpm,Liquid Cooled,Self Start Only,Fuel Injection,"Assist & Slip, Multi-Plate",6 Speed,102 mm,73.6 mm,12.5:1,bs6-2.0,,,Sports Naked Bikes,Yes,830 mm,ZF Sachs Fully Adjustable Inverted Telescopic Cartidge Fork / 120mm,,
Indian FTR Black Smoke,2185731,Liquid Cooled V-Twin,1203 cc,120 Nm @ 6000 rpm,Liquid Cooled,Self Start Only,Fuel Injection,"Assist & Slip, Multi-Plate",6 Speed,102 mm,73.6 mm,12.5:1,bs6-2.0,,,Sports Naked Bikes,Yes,830 mm,ZF Sachs Fully Adjustable Inverted Telescopic Cartidge Fork / 120mm,,
Indian FTR Rally Titanium Smoke,2249172,Liquid Cooled V-Twin,1203 cc,120 Nm @ 6000 rpm,Liquid Cooled,Self Start Only,Fuel Injection,"Assist & Slip, Multi-Plate",6 Speed,102 mm,73.6 mm,12.5:1,bs6-2.0,,,Sports Naked Bikes,,867 mm,Inverted Telescopic Cartridge Fork / 150 mm,,
Indian FTR S White Smoke,2369733,Liquid Cooled V-Twin,1203 cc,120 Nm @ 6000 rpm,Liquid Cooled,Self Start Only,Fuel Injection,"Assist & Slip, Multi-Plate",6 Speed,102 mm,73.6 mm,12.5:1,bs6-2.0,,,Sports Naked Bikes,Yes,830 mm,ZF Sachs Fully Adjustable Inverted Telescopic Cartidge Fork / 120mm,,
Indian Scout Maroon Metallic,2013926,Liquid Cooled V-Twin,1133 cc,97 Nm @ 5600 rpm,Liquid Cooled,Self Start Only,Fuel Injection,"Wet, Multi-Plate",6 Speed,99 mm,73.6 mm,10.7:1,bs6,,,Cruiser Bikes,,916 mm,Telescopic Fork/120 mm,,
Indian Scout SIlver Quartz Metallic/8lack,2068465,Liquid Cooled V-Twin,1133 cc,97 Nm @ 5600 rpm,Liquid Cooled,Self Start Only,Fuel Injection,"Wet, Multi-Plate",6 Speed,99 mm,73.6 mm,10.7:1,bs6,,,25 kmpl,,Cruiser Bikes,127.8 PS,Telescopic Fork/120 mm,Dual Channel
Indian Scout Black Metallic,2012615,Liquid Cooled V-Twin,1133 cc,97 Nm @ 5600 rpm,Liquid Cooled,Self Start Only,Fuel Injection,"Wet, Multi-Plate",6 Speed,99 mm,73.6 mm,10.7:1,bs6,,,Cruiser Bikes,,916 mm,Telescopic Fork/120 mm,,
Indian Chief Bobber Dark Horse Sagebrush Smoke,2572696,Thunderstroke 116,1890 cc,162 Nm @ 3200 rpm,Air Cooled,Self Start Only,Fuel Injection,"Wet, multi-plate",6 Speed,103.2 mm,113 mm,11.0:1,bs6-2.0,,,20 kmpl,,Cruiser Bikes,Chain Drive,Telescopic Fork / 132 mm,Dual Channel
Indian Chief Bobber Dark Horse Titanium Smoke,2568248,Thunderstroke 116,1890 cc,162 Nm @ 3200 rpm,Air Cooled,Self Start Only,Fuel Injection,"Wet, multi-plate",6 Speed,103.2 mm,113 mm,11.0:1,bs6-2.0,,,Cruiser Bikes,,915 mm,Telescopic Fork / 132 mm,,
Indian Super Chief Limited Blue Slate Metallic,2738203,Thunderstroke 116,1890 cc,162 Nm @ 3200 rpm,Air Cooled,Self Start Only,Fuel Injection,"Wet, Multi-Plate",6 Speed,103.2 mm,113 mm,11.0:1,bs6-2.0,,,Cruiser Bikes,,1079 mm,Telescopic Fork / 132 mm,,
Indian Chief Bobber Dark Horse Black Smoke,2567312,Thunderstroke 116,1890 cc,162 Nm @ 3200 rpm,Air Cooled,Self Start Only,Fuel Injection,"Wet, multi-plate",6 Speed,103.2 mm,113 mm,11.0:1,bs6-2.0,,,Cruiser Bikes,,915 mm,Telescopic Fork / 132 mm,,
Indian Scout Rogue Black Metallic,1951987,Liquid Cooled V-Twin (60 degrees),1133 cc,97 Nm @ 5600 rpm,Liquid Cooled,Self Start Only,Fuel Injection,"Wet, Multi-Plate",6 Speed,99 mm,73.6 mm,10.7:1,bs6-2.0,,,Cruiser Bikes,,995 mm,Telescopic Fork/120 mm,,
Indian Scout Rogue Black Smoke,1952863,Liquid Cooled V-Twin (60 degrees),1133 cc,97 Nm @ 5600 rpm,Liquid Cooled,Self Start Only,Fuel Injection,"Wet, Multi-Plate",6 Speed,99 mm,73.6 mm,10.7:1,bs6-2.0,,,Cruiser Bikes,,995 mm,Telescopic Fork/120 mm,,
Indian Scout Rogue Stealth Gray,1965995,Liquid Cooled V-Twin (60 degrees),1133 cc,97 Nm @ 5600 rpm,Liquid Cooled,Self Start Only,Fuel Injection,"Wet, Multi-Plate",6 Speed,99 mm,73.6 mm,10.7:1,bs6-2.0,,,Cruiser Bikes,,995 mm,Telescopic Fork/120 mm,,
Indian Super Chief Limited Maroon Metallic,2738203,Thunderstroke 116,1890 cc,162 Nm @ 3200 rpm,Air Cooled,Self Start Only,Fuel Injection,"Wet, Multi-Plate",6 Speed,103.2 mm,113 mm,11.0:1,bs6-2.0,,,Cruiser Bikes,,1079 mm,Telescopic Fork / 132 mm,,
Indian Chieftain Dark Horse Black Smoke,3796573,Thunderstroke 116,1890 cc,171 Nm @ 3000 rpm,Air Cooled,"Self Start Only,Remote Start",Fuel Injection,"Wet, Multi-Plate, Assist",6 Speed,103.2 mm,113 mm,11.0:1,bs6-2.0,,,Tourer Bikes,,Yes,Telescopic Fork / 119 mm,,
Indian Chieftain Dark Horse Icon Dirt Track Smoke,3584469,Thunderstroke 116,1890 cc,171 Nm @ 3000 rpm,Air Cooled,"Self Start Only,Remote Start",Fuel Injection,"Wet, Multi-Plate, Assist",6 Speed,103.2 mm,113 mm,11.0:1,bs6-2.0,,,Tourer Bikes,,Yes,Telescopic Fork / 119 mm,,
Indian Scout Bobber Black Smoke,1940388,Liquid Cooled V-Twin,1133 cc,97 Nm @ 5600 rpm,Liquid Cooled,Self Start Only,Fuel Injection,"Wet, Multi-Plate",6 Speed,99 mm,73.6 mm,10.7:1,bs6-2.0,,,Cruiser Bikes,,926 mm,No,Telescopic Fork/120 mm,Dual Channel
Indian Scout Bobber Maroon Metallic Smoke,1950892,Liquid Cooled V-Twin,1133 cc,97 Nm @ 5600 rpm,Liquid Cooled,Self Start Only,Fuel Injection,"Wet, Multi-Plate",6 Speed,99 mm,73.6 mm,10.7:1,bs6-2.0,,,Cruiser Bikes,,926 mm,No,Telescopic Fork/120 mm,Dual Channel
Jawa 42 Bobber Black Mirror,255474,"Single Cylinder, 4 Sroke, Liquid Cooled, DOHC",334 cc,32.74 Nm,Self Start Only,Fuel Injection,6 Speed,81 mm,65 mm,11:01,bs6-2.0,,,,,30.56 kmpl,6.36s,Cruiser Bikes,30.64 PS,Disc,
Jawa 42 Bobber Moonstone White,244710,"Single Cylinder, 4 Sroke, Liquid Cooled, DOHC",334 cc,32.74 Nm,Self Start Only,Fuel Injection,6 Speed,81 mm,65 mm,11:01,bs6-2.0,,,,,30.56 kmpl,6.36s,Cruiser Bikes,30.64 PS,Disc,
Jawa 42 2.1 STD,226015,"Single Cylinder, 4 Stroke, Liquid Cooled, DOHC",293 cc,27.02 Nm,1,Liquid Cooled,4,Self Start Only,Fuel Injection,6 Speed,76 mm,65 mm,11:01,bs6-2.0,,Cruiser Bikes,,14 L,No,Telescopic Hydraulic Fork,Dual Channel
Jawa 42 Bobber Jasper Red,244710,"Single Cylinder, 4 Sroke, Liquid Cooled, DOHC",334 cc,32.74 Nm,Self Start Only,Fuel Injection,6 Speed,81 mm,65 mm,11:01,bs6-2.0,,,,,30.56 kmpl,6.36s,Cruiser Bikes,30.64 PS,Disc,
Jawa 42 Bobber Mystic Copper,244710,"Single Cylinder, 4 Sroke, Liquid Cooled, DOHC",334 cc,32.74 Nm,Self Start Only,Fuel Injection,6 Speed,81 mm,65 mm,11:01,bs6-2.0,,,,,30.56 kmpl,6.36s,Cruiser Bikes,30.64 PS,Disc,
Jawa Forty Two Dual Channel - Comet Red,207605,"Single Cylinder, 4 Stroke, Liquid Cooled, DOHC",293 cc,27.02 Nm,1,Liquid Cooled,4,Self Start Only,Fuel Injection,6 Speed,76 mm,65 mm,11:01,bs6-2.0,,Cruiser Bikes,,14 L,Telescopic Hydraulic Fork,,
Jawa Forty Two Dual Channel - Nebula Blue,207605,"Single Cylinder, 4 Stroke, Liquid Cooled, DOHC",293 cc,27.02 Nm,1,Liquid Cooled,4,Self Start Only,Fuel Injection,6 Speed,76 mm,65 mm,11:01,bs6-2.0,,35 kmpl,,Cruiser Bikes,27.33 PS,Telescopic Hydraulic Fork,Dual Channel
Jawa Forty Two Dual Channel - Galactic Green,207605,"Single Cylinder, 4 Stroke, Liquid Cooled, DOHC",293 cc,27.02 Nm,1,Liquid Cooled,4,Self Start Only,Fuel Injection,6 Speed,76 mm,65 mm,11:01,bs6-2.0,,Cruiser Bikes,,14 L,Telescopic Hydraulic Fork,,
Jawa Forty Two Single Channel - Halley's Teal,192391,"Single Cylinder, 4 Stroke, Liquid Cooled, DOHC",293 cc,27.02 Nm,1,Liquid Cooled,4,Self Start Only,Fuel Injection,6 Speed,76 mm,65 mm,11:01,bs6-2.0,,Cruiser Bikes,,14 L,Telescopic Hydraulic Fork,,
Jawa Forty Two Dual Channel - Starlight Blue,202200,"Single Cylinder, 4 Stroke, Liquid Cooled, DOHC",293 cc,27.02 Nm,1,Liquid Cooled,4,Self Start Only,Fuel Injection,6 Speed,76 mm,65 mm,11:01,bs6-2.0,,Cruiser Bikes,,14 L,Telescopic Hydraulic Fork,,
Jawa Forty Two Dual Channel - Lumos Lime,206438,"Single Cylinder, 4 Stroke, Liquid Cooled, DOHC",293 cc,27.02 Nm,1,Liquid Cooled,4,Self Start Only,Fuel Injection,6 Speed,76 mm,65 mm,11:01,bs6-2.0,,Cruiser Bikes,,14 L,Telescopic Hydraulic Fork,,
Jawa Forty Two Single Channel - Nebula Blue,197797,"Single Cylinder, 4 Stroke, Liquid Cooled, DOHC",293 cc,27.02 Nm,1,Liquid Cooled,4,Self Start Only,Fuel Injection,6 Speed,76 mm,65 mm,11:01,bs6-2.0,,Cruiser Bikes,,14 L,Telescopic Hydraulic Fork,,
Jawa Perak STD,242516,"Single Cylinder, Four Stroke, Liquid Cooled, SI Engine, DOHC",334 cc,32. 74 Nm,1,Liquid Cooled,4,Self Start Only,Fuel Injection,6 Speed,81 mm,65 mm,11:01,bs6-2.0,,34.05 kmpl,30.79 kmpl,Cruiser Bikes,11.45s,30. 64 PS,
Jawa Forty Two Dual Channel - Halley's Teal,202200,"Single Cylinder, 4 Stroke, Liquid Cooled, DOHC",293 cc,27.02 Nm,1,Liquid Cooled,4,Self Start Only,Fuel Injection,6 Speed,76 mm,65 mm,11:01,bs6-2.0,,Cruiser Bikes,,14 L,Telescopic Hydraulic Fork,,
Jawa Forty Two Single Channel - Starlight Blue,192391,"Single Cylinder, 4 Stroke, Liquid Cooled, DOHC",293 cc,27.02 Nm,1,Liquid Cooled,4,Self Start Only,Fuel Injection,6 Speed,76 mm,65 mm,11:01,bs6-2.0,,Cruiser Bikes,,14 L,Telescopic Hydraulic Fork,,
Jawa Forty Two Single Channel - Comet Red,197797,"Single Cylinder, 4 Stroke, Liquid Cooled, DOHC",293 cc,27.02 Nm,1,Liquid Cooled,4,Self Start Only,Fuel Injection,6 Speed,76 mm,65 mm,11:01,bs6-2.0,,Cruiser Bikes,,14 L,Telescopic Hydraulic Fork,,
Jawa Forty Two Single Channel - Lumos Lime,196630,"Single Cylinder, 4 Stroke, Liquid Cooled, DOHC",293 cc,27.02 Nm,1,Liquid Cooled,4,Self Start Only,Fuel Injection,6 Speed,76 mm,65 mm,11:01,bs6-2.0,,Cruiser Bikes,,14 L,Telescopic Hydraulic Fork,,
Jawa Forty Two Single Channel - Galactic Green,197797,"Single Cylinder, 4 Stroke, Liquid Cooled, DOHC",293 cc,27.02 Nm,1,Liquid Cooled,4,Self Start Only,Fuel Injection,6 Speed,76 mm,65 mm,11:01,bs6-2.0,,Cruiser Bikes,,14 L,Telescopic Hydraulic Fork,,
Jawa Single Channel - Grey,206502,"Single Cylinder, 4 Stroke, Liquid Cooled, DOHC",293 cc,27.02 Nm,1,Liquid Cooled,4,Self Start Only,Fuel Injection,6 Speed,76 mm,65 mm,11:01,bs6-2.0,,Cruiser Bikes,,14 L,Telescopic Hydraulic Fork,,
Jawa Single Channel - Maroon,207669,"Single Cylinder, 4 Stroke, Liquid Cooled, DOHC",293 cc,27.02 Nm,1,Liquid Cooled,4,Self Start Only,Fuel Injection,6 Speed,76 mm,65 mm,11:01,bs6-2.0,,Cruiser Bikes,,14 L,Telescopic Hydraulic Fork,,
Jawa Dual Channel - Black,231344,"Single Cylinder, 4 Stroke, Liquid Cooled, DOHC",293 cc,27.02 Nm,1,Liquid Cooled,4,Self Start Only,Fuel Injection,6 Speed,76 mm,65 mm,11:01,bs6-2.0,,Cruiser Bikes,,14 L,Telescopic Hydraulic Fork,,
Jawa Single Channel - Black,206502,"Single Cylinder, 4 Stroke, Liquid Cooled, DOHC",293 cc,27.02 Nm,1,Liquid Cooled,4,Self Start Only,Fuel Injection,6 Speed,76 mm,65 mm,11:01,bs6-2.0,,Cruiser Bikes,,14 L,Telescopic Hydraulic Fork,,
Jawa Dual Channel - Maroon,231344,"Single Cylinder, 4 Stroke, Liquid Cooled, DOHC",293 cc,27.02 Nm,1,Liquid Cooled,4,Self Start Only,Fuel Injection,6 Speed,76 mm,65 mm,11:01,bs6-2.0,,Cruiser Bikes,,14 L,Telescopic Hydraulic Fork,,
Khakhi And Midnight Grey Editions,224057,"Single Cylinder, 4 Stroke, Liquid Cooled, DOHC",293 cc,27.02 Nm,1,Liquid Cooled,4,Self Start Only,Fuel Injection,6 Speed,76 mm,65 mm,11:01,bs6-2.0,,33 kmpl,,Cruiser Bikes,27.33 PS,Telescopic Hydraulic Fork,Dual Channel
Jawa Dual Channel - Grey,231344,"Single Cylinder, 4 Stroke, Liquid Cooled, DOHC",293 cc,27.02 Nm,1,Liquid Cooled,4,Self Start Only,Fuel Injection,6 Speed,76 mm,65 mm,11:01,bs6-2.0,,Cruiser Bikes,,14 L,Telescopic Hydraulic Fork,,
Kawasaki Ninja ZX-10R STD,1821224,"Liquid-cooled, 4-stroke In-Line Four",998 cc,114.9 Nm @ 11400 rpm,4,Air Cooled & Liquid Cooled,4,Self Start Only,Fuel Injection,"Wet multi-disc, manual",Digital,6 Speed,76 mm,55 mm,13.0:1,12 kmpl,,"Super Bikes, Sports Bikes",203 PS @ 13200 rpm,"ø43 mm inverted fork (BFF) with external compression chamber, compression and rebound damping and spring preload adjustability, and top-out springs / 120 mm",Dual Channel
Kawasaki Ninja 400 ABS BS6,591981,"Liquid-cooled, 4-stroke Parallel Twin",399 cc,37 Nm @ 8000 rpm,2,Liquid Cooled,4,Self Start Only,Fuel Injection,"Wet multi-disc, manual",Digital,6-Speed,70 mm,51.8 mm,11.5:1,24.18 kmpl,29.24 kmpl,Sports Bikes,5.79s,45 PS @ 10000 rpm,
Kawasaki Vulcan S ABS,848966,"Liquid-cooled, 4-stroke Parallel Twin",649 cc,62.4Nm @ 6600 rpm,2,Liquid Cooled,4,Self Start Only,Fuel Injection,"Wet Multi-Disc, Manual",Digital,6 Speed,83 mm,60 mm,10.8:1,20.58 kmpl,24.37 kmpl,Cruiser Bikes,5.83s,61 PS @ 7500 rpm,
Kawasaki Z900 STD,1025876,"Liquid-cooled, 4-stroke In-Line Four",948 cc,98.6 Nm @ 7700 rpm,4,Liquid Cooled,4,Self Start Only,Fuel Injection,"Wet multi-disc, manual",Digital,6 Speed,73.4 mm,56 mm,11.8:1,17 kmpl,,Sports Naked Bikes,125 PS @ 9500 rpm,ø41 mm inverted fork with rebound damping and spring preload adjustability/120 mm,Dual Channel
Kawasaki Ninja H2 Carbon,,"Liquid Cooled, Inline 4 Cylinder with Supercharger",998 cc,141.7 Nm @ 11000 rpm,4,Liquid Cooled,4,Self Start Only,Fuel Injection,Hydraulic Assist & Slipper Clutch,Digital,6 Speed,76 mm,55 mm,8.5:1,Super Bikes,Yes,770 mm,No,"43 mm inverted fork with rebound and compression damping, spring preload adjustability and top-out springs",Dual Channel
Kawasaki Z650 STD,777495,"Liquid-cooled, 4-stroke Parallel Twin",649 cc,64 Nm @ 6700 rpm,2,Liquid Cooled,4,Self Start Only,Fuel Injection,Digital,6 speed,83 mm,60 mm,10.8:1,bs6-2.0,19.02 kmpl,28.11 kmpl,Sports Naked Bikes,4.81s,68 PS @ 8000 rpm,
Kawasaki W175 Special Edition,202231,"Air-cooled, 4-stroke Single Cylinder",177 cc,13.2 Nm @ 6000 rpm,1,Air Cooled,2,Self Start Only,Fuel Injection,Digital,5 Speed,65.5 mm,52.4 mm,9.1:1,bs6-2.0,45 kmpl,,Cruiser Bikes,13 PS @ 7500 rpm,Ø30 mm telescopic fork / 110 mm,Single Channel
Kawasaki Z650RS 50th Anniversary Edition,783728,"Liquid-cooled, 4-stroke Parallel Twin",649 cc,64 Nm @ 6700 rpm,2,Liquid Cooled,4,Self Start Only,Fuel Injection,"Wet multi-disc, manual",Digital,6 speed,83 mm,60 mm,10.8:1,23 kmpl,,Cafe Racer Bikes,68 PS @ 8000 rpm,ø41 mm telescopic fork/125 mm,"Front :-120/70ZR17,	Rear :-160/60ZR17 - 18"
Kawasaki Ninja 300 ABS,384898,"Liquid-cooled, 4-stroke Parallel Twin",296 cc,26.1 Nm @ 10000 rpm,2,Liquid Cooled,4,Self Start Only,Fuel Injection,Assist & Slipper Clutch,Digital,6 Speed,62 mm,49 mm,10.6:1,30 kmpl,,Sports Bikes,39 PS @ 11000 rpm,37 mm Telescopic Fork / 120 mm,Dual Channel
Kawasaki Z650RS STD,834023,"Liquid-cooled, 4-stroke Parallel Twin",649 cc,64 Nm @ 6700 rpm,2,Liquid Cooled,4,Self Start Only,Fuel Injection,"Wet multi-disc, manual",Digital,6 speed,83 mm,60 mm,10.8:1,Cafe Racer Bikes,,800 mm,ø41 mm telescopic fork/125 mm,,
Kawasaki KLX 110 STD,334383,"Air-cooled, 4-stroke Single",112 cc,8.0 Nm @ 4000 rpm,1,Air Cooled,2,Kick and Self Start,Carburetor,Centrifugal Clutch,Digital DC-CDI,4 Speed Return,53 mm,50.6 mm,9.5:1,"Dirt Bikes, Off Road Bikes",,650 mm,,,
Kawasaki Versys 1000 STD,1462167,"Liquid-cooled, 4-stroke In-Line Four",1043 cc,102 Nm @ 7500 rpm,4,Liquid Cooled,4,Self Start Only,Fuel Injection,Slipper Clutch,Digital,6 Speed,77 mm,56 mm,10.3:1,10 kmpl,,Adventure Tourer Bikes,120 PS @ 9000 rpm,ø43 mm inverted fork with rebound damping (right-side) and spring preload adjustability / 150 mm,Dual Channel
Kawasaki KX 450 STD,959039,"Liquid-cooled, 4-stroke Single",449 cc,1,Liquid Cooled,4,Self Start Only,Fuel Injection,Hydraulic Clutch,Digital DC-CDI,5-speed Return,96.0 mm,62.1 mm,12.5:1,bs6-2.0,"Dirt Bikes, Off Road Bikes",,820 mm,,,
Kawasaki Ninja 1000SX ABS BS6,1445504,"Liquid-cooled, 4-stroke In-line Four",1043 cc,111 Nm @ 8000 rpm,4,Liquid Cooled,4,Self Start Only,Fuel Injection,"Wet, Multi-Disc",Digital,6 Speed,77 mm,56 mm,11.8:1,17 kmpl,,"Super Bikes, Sports Tourer Bikes",142 PS @ 10000 rpm,ø41 mm inverted fork with compression and rebound damping and spring preload adjustability / 120 mm,Dual Channel
Kawasaki Klx230rs STD,580131,"Dirt Bikes, Off Road Bikes",,,,,,,,,,,,,,19.85 PS @ 8000 rpm,,Telescopic fork,,,
Kawasaki Ninja 650 BS6,802354,"Liquid-cooled, 4-stroke Parallel Twin",649 cc,64 Nm @ 6700 rpm,2,Liquid Cooled,4,Self Start Only,Fuel Injection,Digital,6 Speed,83 mm,60 mm,10.8:1,bs6-2.0,21 kmpl,,Sports Bikes,68 PS @ 8000 rpm,ø41 mm telescopic fork / 125 mm,Dual Channel
Kawasaki W800 Street STD,820981,"Air Cooled, 4-stroke Vertical Twin",773 cc,62.9 Nm @ 4800 rpm,Air Cooled,4,Self Start Only,Fuel Injection,Assist & Slipper Clutch,Digital,5 Speed,77 mm,83 mm,8.4:1,bs6-2.0,14 kmpl,,Cruiser Bikes,52 PS @ 6500 rpm,130 mm,Dual Channel
